{
    "type": "entity",
    "name": "ordenes_trabajo",
    "label": "Ordenes_trabajo",
    "version": "1.0",
    "table": {
        "name": "ordenes_trabajos",
        "primaryKey": "id",
        "timestamps": true,
        "softDelete": false,
        "tenantScoped": true
    },
    "fields": [
        {
            "name": "id",
            "type": "int",
            "primary": true,
            "source": "system"
        },
        {
            "name": "numero",
            "type": "string",
            "label": "Numero",
            "required": false,
            "source": "form"
        },
        {
            "name": "fecha",
            "type": "date",
            "label": "Fecha",
            "required": false,
            "source": "form"
        },
        {
            "name": "cliente_id",
            "type": "decimal",
            "label": "Cliente_id",
            "required": false,
            "source": "form"
        },
        {
            "name": "servicio_id",
            "type": "decimal",
            "label": "Servicio_id",
            "required": false,
            "source": "form"
        },
        {
            "name": "equipo",
            "type": "string",
            "label": "Equipo",
            "required": false,
            "source": "form"
        },
        {
            "name": "estado",
            "type": "string",
            "label": "Estado",
            "required": false,
            "source": "form"
        },
        {
            "name": "tecnico",
            "type": "string",
            "label": "Tecnico",
            "required": false,
            "source": "form"
        },
        {
            "name": "valor_total",
            "type": "decimal",
            "label": "Valor_total",
            "required": false,
            "source": "form"
        },
        {
            "name": "saldo",
            "type": "decimal",
            "label": "Saldo",
            "required": false,
            "source": "form"
        }
    ],
    "grids": [],
    "relations": [],
    "rules": [],
    "permissions": {
        "read": [
            "admin",
            "seller"
        ],
        "create": [
            "admin",
            "seller"
        ],
        "update": [
            "admin",
            "seller"
        ],
        "delete": [
            "admin"
        ]
    }
}